{
  "id": "relationship-rotation-001-relcap-0072",
  "run_id": "relationship-rotation-001",
  "query": "crop_relationship",
  "query_kind": "crop_relationship",
  "subject_crop_id": "sunflower",
  "object_crop_id": "wheat",
  "relationship_mode": "rotation",
  "relationship_subtype": "previous_crop_effect",
  "ordered_pair_key": "sunflower|wheat",
  "canonical_relationship_key": "rotation|sunflower|wheat",
  "source_tier_id": "peer_reviewed_science",
  "source_metadata": {
    "doi": "10.70809/6552"
  },
  "source_url": "https://doi.org/10.70809/6552",
  "source_domain": "doi.org",
  "accessed_at": "2026-06-24T14:32:22Z",
  "search_title": "",
  "access_status": "open_full_text",
  "final_url": "https://journal.uni-mate.hu/index.php/gfa/en/article/view/6552",
  "source_title": "Effect of precipitation on wheat (Triticum aestivum), maize (Zea mays), and sunflower (Helianthus annuus) yields in the district of Szentes\n\t\t\t\t\t\t\t| GEORGIKON FOR AGRICULTURE",
  "content_type": "text/html; charset=utf-8",
  "document_type": "html",
  "artifact_path": "exploration/relationships/raw/relationship-rotation-001/fetched/001-journal.uni-mate.hu.html",
  "snippet": "Hungary's three most important arable crops are wheat, maize, and sunflower. These crops have the largest area under cultivation. In our study, we compared the average yields of a 200-ha farm on the outskirts of Szentes city with variations in rainfall conditions. We have shown t",
  "raw_text": "Hungary's three most important arable crops are wheat, maize, and sunflower. These crops have the largest area under cultivation. In our study, we compared the average yields of a 200-ha farm on the outskirts of Szentes city with variations in rainfall conditions. We have shown that the amount of rainfall during the growing season affected the yield averages of wheat and maize and their prices on the world market. Yields of drought-sensitive maize, which prefers humid conditions, were most dependent on rainfall. However, rainfall also proved to be a significant factor in wheat yield averages. Sunflower yield averages did not correlate with rainfall, which may be because water demand is highly dependent on the phenological stage. Therefore, a good rainfall distribution over time is also important for this crop. Changes in rainfall patterns due to climate change do not favor any crop. This is because climate change is reflected in a linear trend in annual rainfall amounts and greater rainfall variability over time and space.\n\ncorresponding author szam.dorottya@uni-nke.hu\n\nAlaei, M., Zaefizadeh, M., Khayatnezhad, M., and Alaei, Z. 2010. Evaluation of Germination Properties of Different Durum Wheat Genotypes under Osmotic Stress. Middle-East Journal of Scientific Research. 6 (6) 642\u2012646.\n\nATIVIZIG, Lower Tisza Region Water Directorate, 2024. Szentes csapad\u00e9kadatok napai, havi \u00e9s \u00e9ves bont\u00e1sban. (in Hungarian)\n\nHetesi, Zs., Sz\u00e1m, D., Lakatos, B., Bel\u00e9nyesi, M., Birinyi, E., Mikus, G., and Krist\u00f3f, D. 2023. A 2022-es asz\u00e1ly \u00e9ghajlati, t\u00e1jhaszn\u00e1lati okai \u00e9s k\u00f6vetkezm\u00e9nyei. Agrof\u00f3rum \u2013 A N\u00f6v\u00e9nytermeszt\u0151k \u00e9s N\u00f6v\u00e9nyv\u00e9d\u0151k Havilapja. 34 (2) 18\u201322. (in Hungarian)\n\nJ\u00e1nosi, A., Fekete, \u00c1., and Sz\u00e1m, D. 2023. Markov-l\u00e1ncok alkalmaz\u00e1sa az asz\u00e1lyos napok val\u00f3sz\u00edn\u0171s\u00e9g\u00e9nek meg\u00e1llap\u00edt\u00e1s\u00e1ra Budapest t\u00e9rs\u00e9g\u00e9ben. Hadm\u00e9rn\u00f6k. 18 (3) 69\u201381. https://doi.org/10.32567/hm.2023.3.6 (in Hungarian)\n\nKSH, Hungarian Hungarian Central Statistical Office, 2020. 19.1.2.1. F\u00f6ldter\u00fclet m\u0171vel\u00e9si \u00e1gak, valamint v\u00e1rmegye \u00e9s r\u00e9gi\u00f3 szerint [ezer hekt\u00e1r]. (in Hungarian) https://www.ksh.hu/stadat_files/mez/hu/mez0068.html\n\nKSH, Hungarian Hungarian Central Statistical Office, 2022. A fontosabb n\u00f6v\u00e9nyek vet\u00e9ster\u00fclete. (in Hungarian) https://www.ksh.hu/s/kiadvanyok/a-fontosabb-novenyek-vetesterulete-2022-junius-1/\n\nKSH, Hungarian Hungarian Central Statistical Office, 2024. 1.1.1.13. Gabonaf\u00e9l\u00e9k felv\u00e1s\u00e1rl\u00e1si \u00e1tlag\u00e1ra [Ft/tonne]. (in Hungarian) https://www.ksh.hu/stadat_files/ara/hu/ara0013.html\n\nLacolla, G., Caranfa, D., Corato, U. D., Cucci, G., Mastro, M. A., and Stellacci, A. M. 2023. Maize Yield Response, Root Distribution, and Soil Desiccation Crack Features as Affected by Row Spacing. Plants. 12 (6) 1380. https://doi.org/10.3390/plants12061380\n\nM\u00e1rton, L., Lehoczky, \u00c9., and W\u00e1gner, G. 2013. Study on the weeds of maize in the infected field with Cirsium Arvense (l.l) scop. Acta Agraria Debreceniensis. 51 131\u2012135. https://www.doi.org/10.34101/actaagrar/51/2077\n\nNouri, A., Etminan, A., Silva, J. A., and Mohammadi, R. 2011. Assessment of yield, yield-related traits, and drought tolerance of durum wheat genotypes (Triticum turgidum var. Durum Desf.). Australian Journal of Crop Science. 5 (1) 8\u201216.\n\nNyiri, L. 1993. F\u00f6ldm\u0171vel\u00e9stan. Mez\u0151gazda Kiad\u00f3, Budapest, 47\u201285. (in Hungarian)\n\nP\u00e1l-F\u00e1m, F. and Rudolf, K. 2014. Gombak\u00f3rokoz\u00f3k a kukoric\u00e1n \u00e9s el\u0151fordul\u00e1suk csapad\u00e9kos \u00e9vekben. Agrof\u00f3rum Extra. 57 84\u201287. (in Hungarian)\n\nRagheid, A., Tahar, B., and Abdellah, A. 2011. An intelligent irrigation system for wheat in Saudi Arabia uses wireless sensors and network technology. International Journal of Water Resources and Arid Environments. 1 (6) 478\u2012482.\n\nStott, P. A., Christidis, N., Otto, F. E. L., Sun, Y., Vanderlinden, J-P., Jan van Oldenborgh, G., Vautard, R., Storch, H., Walton, P., Pascal, Y. W., and Zwiers, F. 2016. Attribution of extreme weather and climate-related events. WIREs Climate Change. 7 23\u201341. https://doi.org/10.1002/wcc.380\n\nTam\u00e1s, A., Rad\u00f3cz, L., Horv\u00e1th, \u00c9., and Zagyi, P. 2022. A termeszt\u00e9stechnol\u00f3giai t\u00e9nyez\u0151k hat\u00e1sa a kukorica (Zea mays L.) term\u00e9seredm\u00e9nyeire polifaktori\u00e1lis tartamk\u00eds\u00e9rletben. N\u00f6v\u00e9nytermel\u00e9s. 71 67\u201280. (in Hungarian)\n\nVarga, P., B\u00e9res, I., and Reisinger, P. 2002: H\u00e1rom vesz\u00e9lyes gyomn\u00f6v\u00e9ny hat\u00e1sa a kukorica term\u00e9salakul\u00e1s\u00e1ra h\u00e1rom elt\u00e9r\u0151 csapad\u00e9kell\u00e1totts\u00e1g\u00fa \u00e9vben. In: XII. Keszthelyi N\u00f6v\u00e9nyv\u00e9delmi F\u00f3rum p. 42. (in Hungarian)\n\nVarga-Haszonits, Z. and Varga, Z. 2005. Nyugat-Magyarorsz\u00e1g \u00e9ghajlati viszonyai \u00e9s a kukorica. p: 71\u201279. In Csete L. (ed) Agro-21 F\u00fczetek, Kl\u00edmav\u00e1ltoz\u00e1s \u2012 Hat\u00e1sok \u2012 V\u00e1laszok. AGRO-21 Kutat\u00e1si Programiroda, Budapest, 43. (in Hungarian)\n\nW\u00f3jcik-Gront, E. and Gozdowski, D. 2023. Effect of Climate Change in Years 2006\u20122019 on Crop Yields in Poland. European Journal of Sustainable Development. 12 (4) 225\u2012236. https:www.doi.org/10.14207/ejsd.2023.v12n4p225\n\nXuemei, J. I., Jianlin, W., David, C. L., Colin, L. D. J., Anthony, G. C., Richard A. R., and Rudy, D. 2010. Importance of pre-anthesis and sink strength for maintenance of grain number during reproductive stage water stress in wheat. Plant, Cell and Environment 33 (6) 926\u2012942. https://doi.org/10.1111/j.1365-3040.2010.02130.x\n\nCopyright (c) 2024 Sz\u00e1m Dorottya, Keve G\u00e1bor, Koch D\u00e1niel, Hetesi Zsolt\n\nThis work is licensed under a Creative Commons Attribution-NonCommercial-NoDerivatives 4.0 International License .\n\nCikkre a Creative Commons 4.0 standard licenc al\u00e1bbi t\u00edpusa vonatkozik: CC-BY-NC-ND-4.0 . Ennek \u00e9rtelm\u00e9ben a m\u0171 szabadon m\u00e1solhat\u00f3, terjeszthet\u0151, bemutathat\u00f3 \u00e9s el\u0151adhat\u00f3, azonban nem haszn\u00e1lhat\u00f3 fel kereskedelmi c\u00e9lokra (NC), tov\u00e1bb\u00e1 nem m\u00f3dos\u00edthat\u00f3 \u00e9s nem k\u00e9sz\u00edthet\u0151 bel\u0151le \u00e1tdolgoz\u00e1s, sz\u00e1rmaz\u00e9kos m\u0171 (ND). A licenc alapj\u00e1n a szerz\u0151 vagy a jogosult \u00e1ltal meghat\u00e1rozott m\u00f3don fel kell t\u00fcntetni a szerz\u0151 nev\u00e9t \u00e9s a szerz\u0151i m\u0171 c\u00edm\u00e9t (BY).",
  "parser_used": "parse-document",
  "candidate_claims": [],
  "failures": [],
  "status": "parsed"
}
